{
  "ai_use_policy_checks": [
    {
      "check_id": "disclosure:AI-assisted planning",
      "message": "present",
      "passed": true
    },
    {
      "check_id": "disclosure:author reviewed, edited, and approved",
      "message": "present",
      "passed": true
    },
    {
      "check_id": "disclosure:AI systems were not used as authors",
      "message": "present",
      "passed": true
    },
    {
      "check_id": "human_final_authoring_required",
      "message": "human final authoring is required by policy",
      "passed": true
    }
  ],
  "citation_checks": [
    {
      "check_id": "citation:C1",
      "message": "ready",
      "passed": true
    },
    {
      "check_id": "citation:C2",
      "message": "ready",
      "passed": true
    },
    {
      "check_id": "citation:C3",
      "message": "ready",
      "passed": true
    },
    {
      "check_id": "citation:C4",
      "message": "ready",
      "passed": true
    },
    {
      "check_id": "citation:C5",
      "message": "ready",
      "passed": true
    },
    {
      "check_id": "citation:C6",
      "message": "ready",
      "passed": true
    },
    {
      "check_id": "citation:C7",
      "message": "ready",
      "passed": true
    },
    {
      "check_id": "citation:C8",
      "message": "ready",
      "passed": true
    },
    {
      "check_id": "citation:C9",
      "message": "ready",
      "passed": true
    },
    {
      "check_id": "citation:C10",
      "message": "ready",
      "passed": true
    },
    {
      "check_id": "citation:C11",
      "message": "ready",
      "passed": true
    },
    {
      "check_id": "citation:C12",
      "message": "ready",
      "passed": true
    },
    {
      "check_id": "citation:C13",
      "message": "ready",
      "passed": true
    }
  ],
  "claim_checks": [
    {
      "check_id": "claim:C1",
      "message": "evidence mapped",
      "passed": true
    },
    {
      "check_id": "claim:C2",
      "message": "evidence mapped",
      "passed": true
    },
    {
      "check_id": "claim:C3",
      "message": "evidence mapped",
      "passed": true
    },
    {
      "check_id": "claim:C4",
      "message": "evidence mapped",
      "passed": true
    },
    {
      "check_id": "claim:C5",
      "message": "evidence mapped",
      "passed": true
    },
    {
      "check_id": "claim:C6",
      "message": "evidence mapped",
      "passed": true
    },
    {
      "check_id": "claim:C7",
      "message": "evidence mapped",
      "passed": true
    },
    {
      "check_id": "claim:C8",
      "message": "evidence mapped",
      "passed": true
    },
    {
      "check_id": "claim:C9",
      "message": "evidence mapped",
      "passed": true
    },
    {
      "check_id": "claim:C10",
      "message": "evidence mapped",
      "passed": true
    },
    {
      "check_id": "claim:C11",
      "message": "evidence mapped",
      "passed": true
    },
    {
      "check_id": "claim:C12",
      "message": "evidence mapped",
      "passed": true
    },
    {
      "check_id": "claim:C13",
      "message": "evidence mapped",
      "passed": true
    }
  ],
  "errors": [],
  "evidence_checks": [
    {
      "check_id": "evidence:C1:README.md",
      "message": "exists",
      "passed": true
    },
    {
      "check_id": "evidence:C1:schemas/asiep.schema.json",
      "message": "exists",
      "passed": true
    },
    {
      "check_id": "evidence:C1:docs/research_note_v0.1.md",
      "message": "exists",
      "passed": true
    },
    {
      "check_id": "evidence:C2:interfaces/asiep_evidence_bundle.schema.json",
      "message": "exists",
      "passed": true
    },
    {
      "check_id": "evidence:C2:src/asiep_resolver/resolver.py",
      "message": "exists",
      "passed": true
    },
    {
      "check_id": "evidence:C2:docs/evidence_bundle_resolver.md",
      "message": "exists",
      "passed": true
    },
    {
      "check_id": "evidence:C3:src/asiep_validator",
      "message": "exists",
      "passed": true
    },
    {
      "check_id": "evidence:C3:src/asiep_repairer",
      "message": "exists",
      "passed": true
    },
    {
      "check_id": "evidence:C3:src/asiep_resolver",
      "message": "exists",
      "passed": true
    },
    {
      "check_id": "evidence:C3:src/asiep_importer",
      "message": "exists",
      "passed": true
    },
    {
      "check_id": "evidence:C3:src/asiep_packager",
      "message": "exists",
      "passed": true
    },
    {
      "check_id": "evidence:C3:src/asiep_evaluator",
      "message": "exists",
      "passed": true
    },
    {
      "check_id": "evidence:C3:tests/test_validator.py",
      "message": "exists",
      "passed": true
    },
    {
      "check_id": "evidence:C3:tests/test_repair_loop.py",
      "message": "exists",
      "passed": true
    },
    {
      "check_id": "evidence:C3:tests/test_resolver.py",
      "message": "exists",
      "passed": true
    },
    {
      "check_id": "evidence:C3:tests/test_importer.py",
      "message": "exists",
      "passed": true
    },
    {
      "check_id": "evidence:C3:tests/test_packager.py",
      "message": "exists",
      "passed": true
    },
    {
      "check_id": "evidence:C3:tests/test_evaluator.py",
      "message": "exists",
      "passed": true
    },
    {
      "check_id": "evidence:C4:profiles/asiep/v0.1/profile.json",
      "message": "exists",
      "passed": true
    },
    {
      "check_id": "evidence:C4:profiles/index.json",
      "message": "exists",
      "passed": true
    },
    {
      "check_id": "evidence:C4:docs/agent_native_design.md",
      "message": "exists",
      "passed": true
    },
    {
      "check_id": "evidence:C5:reports/asiep_v0.1_evaluation_report.json",
      "message": "exists",
      "passed": true
    },
    {
      "check_id": "evidence:C5:src/asiep_evaluator/evaluator.py",
      "message": "exists",
      "passed": true
    },
    {
      "check_id": "evidence:C5:paper_assets/tables/evaluation_metrics.md",
      "message": "exists",
      "passed": true
    },
    {
      "check_id": "evidence:C6:reports/asiep_v0.1_evaluation_report.json",
      "message": "exists",
      "passed": true
    },
    {
      "check_id": "evidence:C6:paper_assets/tables/attack_corpus_results.md",
      "message": "exists",
      "passed": true
    },
    {
      "check_id": "evidence:C6:evaluation/corpus/asiep_v0.1_corpus.json",
      "message": "exists",
      "passed": true
    },
    {
      "check_id": "evidence:C7:reports/asiep_v0.1_evaluation_report.json",
      "message": "exists",
      "passed": true
    },
    {
      "check_id": "evidence:C7:paper_assets/tables/evaluation_metrics.md",
      "message": "exists",
      "passed": true
    },
    {
      "check_id": "evidence:C7:evaluation/corpus/asiep_v0.1_corpus.json",
      "message": "exists",
      "passed": true
    },
    {
      "check_id": "evidence:C8:reports/asiep_v0.1_evaluation_report.json",
      "message": "exists",
      "passed": true
    },
    {
      "check_id": "evidence:C8:evaluation/crosswalk/asiep_v0.1_crosswalk.json",
      "message": "exists",
      "passed": true
    },
    {
      "check_id": "evidence:C8:paper_assets/tables/crosswalk_matrix.md",
      "message": "exists",
      "passed": true
    },
    {
      "check_id": "evidence:C9:evaluation/crosswalk/asiep_v0.1_crosswalk.json",
      "message": "exists",
      "passed": true
    },
    {
      "check_id": "evidence:C9:mappings/prov_mapping.md",
      "message": "exists",
      "passed": true
    },
    {
      "check_id": "evidence:C9:mappings/otel_mapping.md",
      "message": "exists",
      "passed": true
    },
    {
      "check_id": "evidence:C9:mappings/fdo_mapping.md",
      "message": "exists",
      "passed": true
    },
    {
      "check_id": "evidence:C9:mappings/ro_crate_mapping.md",
      "message": "exists",
      "passed": true
    },
    {
      "check_id": "evidence:C10:docs/evaluation_method.md",
      "message": "exists",
      "passed": true
    },
    {
      "check_id": "evidence:C10:manuscript/limitations.md",
      "message": "exists",
      "passed": true
    },
    {
      "check_id": "evidence:C10:README.md",
      "message": "exists",
      "passed": true
    },
    {
      "check_id": "evidence:C11:reports/asiep_v0.1_evaluation_report.json",
      "message": "exists",
      "passed": true
    },
    {
      "check_id": "evidence:C11:manuscript/limitations.md",
      "message": "exists",
      "passed": true
    },
    {
      "check_id": "evidence:C11:src/asiep_evaluator/evaluator.py",
      "message": "exists",
      "passed": true
    },
    {
      "check_id": "evidence:C12:docs/fdo_rocrate_packaging.md",
      "message": "exists",
      "passed": true
    },
    {
      "check_id": "evidence:C12:manuscript/limitations.md",
      "message": "exists",
      "passed": true
    },
    {
      "check_id": "evidence:C12:interfaces/asiep_fdo_record.schema.json",
      "message": "exists",
      "passed": true
    },
    {
      "check_id": "evidence:C12:interfaces/asiep_rocrate_metadata.schema.json",
      "message": "exists",
      "passed": true
    },
    {
      "check_id": "evidence:C13:manuscript/related_work_matrix.md",
      "message": "exists",
      "passed": true
    },
    {
      "check_id": "evidence:C13:docs/research_note_v0.1.md",
      "message": "exists",
      "passed": true
    },
    {
      "check_id": "evidence:C13:manuscript/venue_positioning.md",
      "message": "exists",
      "passed": true
    }
  ],
  "limitation_checks": [
    {
      "check_id": "positioning:FAIR evidence object",
      "message": "present",
      "passed": true
    },
    {
      "check_id": "positioning:reproducible agent evidence pipeline",
      "message": "missing",
      "passed": false
    },
    {
      "check_id": "positioning:provenance",
      "message": "present",
      "passed": true
    },
    {
      "check_id": "positioning:scientific infrastructure",